<?xml version="1.0" encoding="UTF-8"?>

<!-- %W  main.xml        GAP 4 package AtlasRep             Thomas Breuer -->
<!-- %Y  Copyright 2006, Lehrstuhl D für Mathematik, RWTH Aachen, Germany -->

<!DOCTYPE Book SYSTEM "gapdoc.dtd"
   [ <!ENTITY ATLAS "<Package>ATLAS</Package>">

     <!ENTITY ATLASSERVER "<URL>http://brauer.maths.qmul.ac.uk/Atlas</URL>">
     <!ENTITY ATLASREPHOME "http://www.math.rwth-aachen.de/~Thomas.Breuer/atlasrep">
     <!ENTITY WILSONMAIL "<Email>R.A.Wilson@qmul.ac.uk</Email>">

     <!ENTITY mdash "<Alt Only='HTML'>&#8212;</Alt><Alt Not='HTML'>---</Alt>">

     <!ENTITY VERSIONNUMBER "1.5">
     <!ENTITY RELEASEMONTH "July">
     <!ENTITY RELEASEYEAR "2011">
   ]>

<Book Name="AtlasRep">

<TitlePage>
  <Title><Package>AtlasRep</Package> &mdash; A GAP 4 Package<Index>AtlasRep</Index></Title>
  <Version>(Version &VERSIONNUMBER;)
  </Version>
  <Author>Robert A. Wilson
    &WILSONMAIL;
    <Homepage>http://www.maths.qmw.ac.uk/~raw</Homepage>
  </Author>
  <Author>Richard A. Parker
    <Email>richpark@gmx.co.uk</Email>
  </Author>
  <Author>Simon Nickerson
    <Email>simonn@maths.bham.ac.uk</Email>
    <Homepage>http://web.mat.bham.ac.uk/S.Nickerson</Homepage>
  </Author>
  <Author>John N. Bray
    <Email>J.N.Bray@qmul.ac.uk</Email>
    <Homepage>http://www.maths.qmw.ac.uk/~jnb</Homepage>
  </Author>
  <Author>Thomas Breuer
    <Email>sam@Math.RWTH-Aachen.De</Email>
    <Homepage>http://www.math.rwth-aachen.de/~Thomas.Breuer</Homepage>
  </Author>
  <Copyright>
    &copyright; 2002&ndash;2011
    <P/>
    This package may be distributed under the terms and conditions of the
    GNU Public License Version 3 or later,
    see <URL>http://www.gnu.org/licenses</URL>.
  </Copyright>
</TitlePage>

<TableOfContents/>

<Body>

<#Include SYSTEM "introduc.xml">

<#Include SYSTEM "tutorial.xml">

<#Include SYSTEM "interfac.xml">

<#Include SYSTEM "atlasrep.xml">

<#Include SYSTEM "extend.xml">

<#Include SYSTEM "utils.xml">

<#Include SYSTEM "technica.xml">

</Body>

<Bibliography Databases="manualbib.xml,../../../doc/manualbib.xml,../../ctbllib/doc/manualbib.xml"/>

<TheIndex/>

</Book>

<!-- ==================================================================== -->

