<?xml version="1.0" encoding="UTF-8"?>

<!DOCTYPE Book SYSTEM "gapdoc.dtd"
   [ <!ENTITY CTblLib "<Package>CTblLib</Package>">
     <!ENTITY ATLAS "<Package>Atlas</Package>">
     <!ENTITY MOC "<Package>MOC</Package>">
     <!ENTITY CAS "<Package>CAS</Package>">

     <!ENTITY AUTHOREMAIL "<Email>sam@math.rwth-aachen.de</Email>">

     <!ENTITY mdash "<Alt Only='HTML'>&#8212;</Alt><Alt Not='HTML'>---</Alt>">

     <!ENTITY VERSIONNUMBER "1.2.1">
     <!ENTITY RELEASEMONTH "May">
     <!ENTITY RELEASEYEAR "2012">
   ]>

<Book Name="CTblLib">

<TitlePage>
  <Title>The &GAP; Character Table Library<Index>CTblLib</Index></Title>
  <Version>(Version &VERSIONNUMBER;)
  </Version>
  <Author>Thomas Breuer
    &AUTHOREMAIL;
  <!--   <Email>sam@Math.RWTH-Aachen.De</Email>   -->
    <Homepage>http://www.math.rwth-aachen.de/~Thomas.Breuer</Homepage>
  </Author>
  <Copyright>
    &copyright; 2003&ndash;2012
    <P/>
    This package may be distributed under the terms and conditions of the
    GNU Public License Version 3 or later,
    see <URL>http://www.gnu.org/licenses</URL>.
  </Copyright>
</TitlePage>

<TableOfContents/>

<Body>

<#Include SYSTEM "introduc.xml">

<#Include SYSTEM "tutorial.xml">

<#Include SYSTEM "interfac.xml">

<#Include SYSTEM "ctbllibr.xml">

<#Include SYSTEM "construc.xml">

<#Include SYSTEM "ctblothe.xml">

</Body>


<Bibliography Databases="manualbib.xml,../../../doc/manualbib.xml,../../atlasrep/doc/manualbib.xml,../../Browse/doc/browsebib.xml"/>

<TheIndex/>

</Book>

<!-- ==================================================================== -->

