<?xml version="1.0" encoding="UTF-8"?>

<!-- This is an automatically generated file. -->
<!DOCTYPE Book SYSTEM "gapdoc.dtd"
[
<!ENTITY see '<Alt Only="LaTeX">$	o$</Alt><Alt Not="LaTeX">--&gt;</Alt>'>
<!ENTITY PolymakeInterface '<Package>PolymakeInterface</Package>'>
]
>
<Book Name="PolymakeInterface">
<#Include SYSTEM "title.xml">
<TableOfContents/>
<Body>
<Index>&PolymakeInterface;</Index>
<#Include SYSTEM "AutoDocMainFile.xml">
</Body>
<Bibliography Databases="PolymakeInterface.bib"/>
<TheIndex/>
</Book>
