<!-- ------------------------------------------------------------------- -->
<!--                                                                     -->
<!--  manual.xml           KAN documentation              Chris Wensley  -->
<!--                                                    & Anne Heyworth  -->
<!--  version 1.07, 09/10/2013                                           -->
<!--                                                                     -->
<!--  Copyright (C) 2005-2013, Anne Heyworth and Chris Wensley,          --> 
<!--  School of Computer Science, Bangor University, U.K.                --> 
<!--                                                                     -->
<!-- ------------------------------------------------------------------- -->

<?xml version="1.0" encoding="UTF-8"?>

<!-- Reading data chunk from the PackageInfo.g file --> 

<!DOCTYPE Book SYSTEM "gapdoc.dtd"
  [<!ENTITY kan "<Package>Kan</Package>"> 
   <#Include Label="PKGVERSIONDATA"> 
  ]> 

<Book Name="Kan"> 

<TitlePage>
  <Title>&kan;</Title>
  <Subtitle>A package for Induced Category Actions</Subtitle>
  <Version>Version &VERSION;</Version>   
  <Date>&RELEASEDATE;</Date> 
  <Author> Anne Heyworth
  </Author>    
  <Author> Chris Wensley
    <Email>c.d.wensley@bangor.ac.uk</Email>
    <Homepage>http://www.bangor.ac.uk/~mas023/</Homepage>
    <Address>
      School of Computer Science, Bangor University,<Br/>
      Dean Street, Bangor, Gwynedd, LL57 1UT, U.K.
    </Address>
  </Author>

<Abstract>
The &kan; package was originally implemented in 1997 using 
the &GAP; 3 language, to compute induced actions of categories, 
when the first author was studying for a Ph.D. in Bangor.
<P/>
This reduced version only provides functions for the computation of 
normal forms of representatives of double cosets of finitely presented groups. 
<P/>
Bug reports, suggestions and comments are, of course, welcome. 
Please contact the second author at     
<Email>c.d.wensley@bangor.ac.uk</Email>.
</Abstract>

<Copyright> 
<Index>License</Index>
&copyright; 2005-2013 Anne Heyworth and Chris Wensley <P/>

<Package>kan</Package> is free software; you can redistribute it 
and/or modify it under the terms of the 
<URL Text="GNU General Public License">http://www.fsf.org/licenses/gpl.html</URL> 
as published by the Free Software Foundation; 
either version 2 of the License, or (at your option) any later version.
</Copyright> 

<Acknowledgements>
This documentation was prepared with the <Package>GAPDoc</Package> 
package of Frank L&#xfc;beck and Max Neunh&#xf6;ffer. 
</Acknowledgements>

</TitlePage>

<TableOfContents/>

<Body>

<#Include SYSTEM "intro.xml">
<#Include SYSTEM "dcrws.xml">
<#Include SYSTEM "history.xml">

</Body>

<Bibliography Databases="manual"/>

<TheIndex/>

</Book>
