<?xml version="1.0" encoding="UTF-8"?>

<!DOCTYPE Book SYSTEM "gapdoc.dtd">

<!--

  recogbase.xml          recogbase package documentation                
                                                                Max Neunhoeffer
                                                                and Ákos Seress

  Copyright (C) 2005-2008 by the authors.

-->

<Book Name="recogbase">

<TitlePage>
    <Title>GAP 4 Package <Package>recogbase</Package></Title>
    <Subtitle>A framework for group recognition</Subtitle>
    <Version>
      <#Include SYSTEM "../VERSION">
    </Version>
    <Author>Max Neunhoeffer
    <Address>School of Mathematics and Statistics, Mathematical
        Institute, North Haugh, St Andrews,
        Fife, KY16 9SS, Scotland, UK</Address>
    <Email>neunhoef@mcs.st-and.ac.uk</Email>
    <Homepage>http://www-groups.mcs.st-and.ac.uk/~neunhoef/</Homepage>
    </Author>
    <Author>Ákos Seress
<Address>
Department of Mathematics,
The Ohio State University,
231 W 18th Avenue,
Columbus, OH 43210 USA 
</Address>
    <Email>akos@math.ohio-state.edu</Email>
    <Homepage>http://www.math.ohio-state.edu/people/display/display.php?ID=302
    </Homepage>
    </Author>
    <Date>March 2014</Date>

<Copyright>
  &copyright; 2005-2011 by Max Neunhöffer and Ákos Seress<P/>

  This package may be distributed under the terms and conditions of the
  GNU Public License Version 3 or (at your option) any later version.
</Copyright>

</TitlePage>

<!--  TableOfContents  . . . . . .  generate a table of contents   -->
<TableOfContents/>

<!--  The only chapter of the book  --> 
<Body>
<#Include SYSTEM "intro.xml">
<#Include SYSTEM "install.xml">
<#Include SYSTEM "methsel.xml">
<#Include SYSTEM "recognition.xml">
<#Include SYSTEM "afterrecog.xml">
</Body>

<Bibliography Databases="recogbase"/>

<!--  And finally an index as well   -->
<TheIndex/>

</Book>

